{
  "schemaVersion": "0.1.0",
  "generator": { "name": "runray", "version": "0.1.0" },
  "generatedAt": "2026-07-02T14:30:00Z",
  "runs": [
    {
      "id": "run_c1a2b3",
      "source": {
        "tool": "claude-code",
        "format": "claude-jsonl",
        "files": ["/home/user/.claude/projects/-home-user-project/9f1e-4a.jsonl"]
      },
      "title": "Fix failing checkout tests",
      "project": { "name": "project", "path": "/home/user/project", "gitBranch": "fix/checkout" },
      "startedAt": "2026-07-02T13:02:10Z",
      "endedAt": "2026-07-02T13:11:42Z",
      "durationMs": 572000,
      "spans": [
        { "id": "s1", "parentId": null, "kind": "session", "name": "session", "status": "ok",
          "startedAt": "2026-07-02T13:02:10Z", "endedAt": "2026-07-02T13:11:42Z", "durationMs": 572000,
          "depth": 0, "attributes": {}, "provenance": { "file": "9f1e-4a.jsonl", "line": 1 } },
        { "id": "s2", "parentId": "s1", "kind": "llm_call", "name": "claude-sonnet-4-6", "status": "ok",
          "startedAt": "2026-07-02T13:02:11Z", "endedAt": "2026-07-02T13:02:29Z", "durationMs": 18000, "depth": 1,
          "llm": { "provider": "anthropic", "model": "claude-sonnet-4-6",
            "tokens": { "input": 12480, "output": 610, "cacheRead": 0, "cacheWrite": 11020 },
            "costUSD": 0.0879, "costSource": "computed", "stopReason": "tool_use" },
          "content": { "promptPreview": "REDACTED", "outputPreview": "REDACTED" },
          "attributes": { "gen_ai.request.model": "claude-sonnet-4-6" },
          "provenance": { "file": "9f1e-4a.jsonl", "line": 3 } },
        { "id": "s3", "parentId": "s2", "kind": "tool_call", "name": "Bash", "status": "error",
          "statusReason": "exit 1", "startedAt": "2026-07-02T13:02:30Z", "endedAt": "2026-07-02T13:02:41Z",
          "durationMs": 11000, "depth": 2,
          "tool": { "name": "Bash", "isError": true, "exitCode": 1, "outputBytes": 18240 },
          "attributes": {}, "provenance": { "file": "9f1e-4a.jsonl", "line": 5 } },
        { "id": "s4", "parentId": "s2", "kind": "tool_call", "name": "Bash", "status": "error",
          "statusReason": "exit 1", "startedAt": "2026-07-02T13:03:02Z", "endedAt": "2026-07-02T13:03:14Z",
          "durationMs": 12000, "depth": 2,
          "tool": { "name": "Bash", "isError": true, "exitCode": 1, "outputBytes": 18310 },
          "attributes": {}, "provenance": { "file": "9f1e-4a.jsonl", "line": 9 } },
        { "id": "s5", "parentId": "s2", "kind": "tool_call", "name": "Bash", "status": "error",
          "statusReason": "exit 1", "startedAt": "2026-07-02T13:03:40Z", "endedAt": "2026-07-02T13:03:52Z",
          "durationMs": 12000, "depth": 2,
          "tool": { "name": "Bash", "isError": true, "exitCode": 1, "outputBytes": 18275 },
          "attributes": {}, "provenance": { "file": "9f1e-4a.jsonl", "line": 13 } },
        { "id": "s6", "parentId": "s1", "kind": "llm_call", "name": "claude-sonnet-4-6", "status": "ok",
          "startedAt": "2026-07-02T13:04:05Z", "endedAt": "2026-07-02T13:04:31Z", "durationMs": 26000, "depth": 1,
          "llm": { "provider": "anthropic", "model": "claude-sonnet-4-6",
            "tokens": { "input": 31240, "output": 890, "cacheRead": 10800, "cacheWrite": 0 },
            "costUSD": 0.1103, "costSource": "computed", "stopReason": "tool_use" },
          "attributes": {}, "provenance": { "file": "9f1e-4a.jsonl", "line": 17 } },
        { "id": "s7", "parentId": "s6", "kind": "subagent", "name": "subagent:test-runner", "status": "ok",
          "startedAt": "2026-07-02T13:04:33Z", "endedAt": "2026-07-02T13:09:58Z", "durationMs": 325000, "depth": 2,
          "agent": { "name": "test-runner", "sessionId": "side_77ab" },
          "content": { "delegationReason": "Run unit tests and fix any failing specs" },
          "attributes": { "claude.isSidechain": true }, "provenance": { "file": "9f1e-4a.jsonl", "line": 21 } },
        { "id": "s8", "parentId": "s7", "kind": "llm_call", "name": "claude-haiku-4-5", "status": "ok",
          "startedAt": "2026-07-02T13:04:35Z", "endedAt": "2026-07-02T13:05:02Z", "durationMs": 27000, "depth": 3,
          "llm": { "provider": "anthropic", "model": "claude-haiku-4-5",
            "tokens": { "input": 8420, "output": 1240, "cacheRead": 0, "cacheWrite": 0 },
            "costUSD": 0.0146, "costSource": "computed", "stopReason": "tool_use" },
          "attributes": {}, "provenance": { "file": "9f1e-4a.jsonl", "line": 23 } },
        { "id": "s9", "parentId": "s8", "kind": "tool_call", "name": "Edit", "status": "ok",
          "startedAt": "2026-07-02T13:05:04Z", "endedAt": "2026-07-02T13:05:05Z", "durationMs": 1000, "depth": 4,
          "tool": { "name": "Edit", "isError": false, "linesAdded": 24, "linesRemoved": 5 },
          "attributes": {}, "provenance": { "file": "9f1e-4a.jsonl", "line": 27 } },
        { "id": "s10", "parentId": "s1", "kind": "llm_call", "name": "claude-sonnet-4-6", "status": "ok",
          "startedAt": "2026-07-02T13:10:10Z", "endedAt": "2026-07-02T13:11:40Z", "durationMs": 90000, "depth": 1,
          "llm": { "provider": "anthropic", "model": "claude-sonnet-4-6",
            "tokens": { "input": 48900, "output": 2210, "cacheRead": 10800, "cacheWrite": 0 },
            "costUSD": 0.1831, "costSource": "computed", "stopReason": "end_turn" },
          "attributes": {}, "provenance": { "file": "9f1e-4a.jsonl", "line": 41 } }
      ],
      "totals": {
        "tokens": { "input": 101040, "output": 4950, "cacheRead": 21600, "cacheWrite": 11020, "reasoning": 0, "total": 138610 },
        "costUSD": { "total": 0.3959, "wastedEstimate": 0.0940,
          "byModel": { "claude-sonnet-4-6": 0.3813, "claude-haiku-4-5": 0.0146 } },
        "counts": { "llmCalls": 4, "toolCalls": 4, "toolErrors": 3, "subagents": 1, "maxDepth": 4 },
        "cache": { "hitRate": 0.176 },
        "codeChanges": { "linesAdded": 24, "linesRemoved": 5 }
      },
      "insights": [
        { "id": "i1", "ruleId": "retry-loop", "severity": "warning",
          "title": "Bash failed 3× in a row",
          "detail": "The same Bash command failed three consecutive times (exit 1), driving ~$0.09 of retried model calls before the approach changed.",
          "spanIds": ["s3", "s4", "s5"], "estimatedWasteUSD": 0.094,
          "suggestion": "Add the missing test dependency to the setup step so the first Bash attempt succeeds." },
        { "id": "i2", "ruleId": "low-cache-hit", "severity": "info",
          "title": "Cache hit-rate at 17.6%",
          "detail": "Only 21.6k of 122.6k input-class tokens were served from cache; a stable session prefix would have converted most of the 101k input tokens to cache reads.",
          "spanIds": ["s6", "s10"], "estimatedWasteUSD": 0.212,
          "suggestion": "Resume the same session for follow-up prompts instead of starting fresh." }
      ]
    }
  ]
}
